post_id,post_datetime,username,post_url,post_tags,post_summary
8434405,2022-07-18 11:20:00+01:00,RemzP,https://h30434.www3.hp.com/t5/Notebook-Hardware-and-Upgrade-Questions/Broken-hinge-on-HP-Envy-x360/m-p/8434405?search-action-id=576248915755&search-result-uid=8434405,['Microsoft Windows 10 (64-bit)'],"Hello, similar to the numerous descriptions listed on here under the same subject line, my HP Envy x360 15” lower right hinge separated from the screen this morning (side note: I spent at least a m..."
7616135,2020-05-21 06:25:00+01:00,SharmaS,https://h30434.www3.hp.com/t5/Notebook-Video-Display-and-Touch/Broken-Hinge/m-p/7616135?search-action-id=576248915755&search-result-uid=7616135,"['HP 15 674tx', 'Microsoft Windows 10 (64-bit)', 'and']",My Laptop Hinge is broken and I am not able to reach out to HP Hardware support team in Bangalore. All the Contact Center numbers are going unanswered.  Is anyone able to reach out to HP customer s...
7863150,2020-11-20 06:59:00+01:00,Carlie88,https://h30434.www3.hp.com/t5/Desktop-Hardware-and-Upgrade-Questions/Broken-screen-and-hinge-replacement/m-p/7863150?search-action-id=576248915755&search-result-uid=7863150,['HP Pavillion All-In-One 24'],The glass screen cracked and the hinge that attaches to the stand snapped. I would love to be able to replace these but I can't find the parts or they aren't available. What can I do? Product n...
8216179,2021-11-15 11:49:00+01:00,Ilia4,https://h30434.www3.hp.com/t5/Notebook-Video-Display-and-Touch/broken-hinge-HP-Envy-13-3-X360/m-p/8216179?search-action-id=576248915755&search-result-uid=8216179,"['HP Envy 13.3 x360', 'broken hinge']",I bought new HP ENVY X360 3 months ago in 29.08.21. Yesterday when I closed the screen I heard a cracking noise. I opened the laptop and found out that the right hinge was broken and out and there w...
8241392,2021-12-14 13:46:00+01:00,MEH84630,https://h30434.www3.hp.com/t5/Notebook-Hardware-and-Upgrade-Questions/Broken-Hinges/m-p/8241392?search-action-id=576248915755&search-result-uid=8241392,"['Microsoft Windows 11', 'hp envy 360']","Like MANY others I have issue with broken hinge on my HP Envy 360. Of course, it broke only a few days after the warranty expired.  I have tried to get help using the virtual assistant, but t..."
8305662,2022-02-15 18:46:00+01:00,Kreid1,https://h30434.www3.hp.com/t5/Notebook-Hardware-and-Upgrade-Questions/Broken-hinge/m-p/8305662?search-action-id=576248915755&search-result-uid=8305662,"['HP ENVY x360 - 15-cn0008ca', 'Microsoft Windows 10 (64-bit)']","Screen just popped out on my laptop. Broken right hinge. Out of warranty, took it to HP service center who said they could not fix it because they were scared to break the screen. Are there any o..."
7561164,2020-04-18 11:52:00+01:00,JaimieHamilton,https://h30434.www3.hp.com/t5/Notebook-Hardware-and-Upgrade-Questions/Broken-hinge-on-HP-Envy-x360/m-p/7561164?search-action-id=576248915755&search-result-uid=7561164,"['Microsoft Windows 10 (64-bit)', 'envy x360']","Hello,  The left hinge of my HP ENVY x360 just broke, the screen popped loose down in the corner and two screws fell out together with some small, plastic pieces.  My warranty ran out last June (2..."
8370164,2022-05-02 06:14:00+01:00,Giorgio57,https://h30434.www3.hp.com/t5/Notebook-Hardware-and-Upgrade-Questions/Re-Broken-Hinge-caused-screen-to-crack/m-p/8370164?search-action-id=576248915755&search-result-uid=8370164,[],"I  am having exactly the same problem with a Pavilion I7 bought in 2019. Incredible timing for breaking down, I guess it must have been verified. Obviously the warranty has expired, and phone su..."
8355529,2022-04-13 10:01:00+01:00,cruisedoggie,https://h30434.www3.hp.com/t5/Notebook-Hardware-and-Upgrade-Questions/Broken-hinge/m-p/8355529?search-action-id=576248915755&search-result-uid=8355529,"['HP ENVY x360 Laptop - 15m-ee0013dx', 'Microsoft Windows 11']",How do I get repair assistance for a broken left hinge on my HP ENVY x360 Laptop? It is no longer under warranty.
8424463,2022-07-06 13:30:00+01:00,Sarahk128,https://h30434.www3.hp.com/t5/Notebook-Hardware-and-Upgrade-Questions/Broken-hinges/m-p/8424463?search-action-id=576248915755&search-result-uid=8424463,['HP ENVY x360 Convertible Laptop PC 13m-bd0000 (172M9AV)'],"...icked up the laptop to move it from my desk to my room and noticed the screen separating because of a broken hinge.. from what I’m seeing HP knows this is an issue, and does not like to fix it even with a..."
8488765,2022-09-21 07:00:00+01:00,jwb11,https://h30434.www3.hp.com/t5/Notebook-Video-Display-and-Touch/broken-hinge-on-left-and-top-cracked-17-by1953cl/m-p/8488765?search-action-id=576248915755&search-result-uid=8488765,['Microsoft Windows 11'],...he hinge screws and parts would cost more than computer is worth.
5753631,2016-09-06 21:54:00+01:00,Coco15,https://h30434.www3.hp.com/t5/Notebook-Hardware-and-Upgrade-Questions/Broken-Hinge/m-p/5753631?search-action-id=576248915755&search-result-uid=5753631,"['HP Envy 15T Toochsmart noteboo', 'Microsoft Windows 10 (64-bit)']","Hope this gets to Jeff.  My computer is out of warranty, But i have a broken hinge.  I brought this computer just 2 years and can afford to buy a new one.  Both hinges on my notebook h..."
984161,2011-10-26 14:05:00+01:00,rainsworth808,https://h30434.www3.hp.com/t5/Printers-Archive-Read-Only/broken-hinge/m-p/984161?search-action-id=576248915755&search-result-uid=984161,"['Archived', 'J6480', 'OJ J6480', 'hinge', 'source-board-id:PostPrint', 'source-board-id:Printing']","I opened the lid today to change the ink cartridge on my All-in-one Officejet J6480, and after installing a new one when I closed the lid  there was a loud crack and the right side hinge broke...."
8452550,2022-08-10 02:14:00+01:00,edleung25,https://h30434.www3.hp.com/t5/Notebook-Video-Display-and-Touch/broken-hinge/m-p/8452550?search-action-id=576248915755&search-result-uid=8452550,"['HP ENVY - 17-u273cl', 'Microsoft Windows 10 (64-bit)']",I have an HP Envy 17-inch laptop.  Out of nowhere today I noticed that the left-side hinge is loose/broken and the front and back are separating from each other on that side.  The system s...
8425722,2022-07-08 06:33:00+01:00,mydearestpotato,https://h30434.www3.hp.com/t5/Notebook-Hardware-and-Upgrade-Questions/Broken-Hinge-for-HP-x360-Pavillion/m-p/8425722?search-action-id=576248915755&search-result-uid=8425722,"['Microsoft Windows 10 (64-bit)', 'hp pavilion x360 14-cd1511sa']",The hinge is broken for my HP Pavillion x360 which has also affected its wifi cable. The warranty has finished for this laptop and I'm struggling to find spare parts as the laptop is relatively new....
8461341,2022-08-20 20:58:00+01:00,taybry,https://h30434.www3.hp.com/t5/Notebook-Hardware-and-Upgrade-Questions/Broken-Hinge/m-p/8461341?search-action-id=576248915755&search-result-uid=8461341,"['HP ENVY x360 Laptop - 15m-ee0023dx', 'Microsoft Windows 10 (64-bit)']","Hello!  I purchased my HP Envy x360 August 2020. It has always worked fine with no issue. Today, I went to flip it over so I could use it as a tablet and the bottom right hinge broke. My computer s..."
8456820,2022-08-15 09:43:00+01:00,sarg1,https://h30434.www3.hp.com/t5/Notebook-Video-Display-and-Touch/Broken-Hinge/m-p/8456820?search-action-id=576248915755&search-result-uid=8456820,"['HP ENVY x360 - 15-bp143cl', 'Microsoft Windows 10 (64-bit)']",I have an HP ENVY x360 Convertible 15-bp1xx (3TS71UA#ABA) laptop. I noticed that the right-side hinge is loose/broken and the front and back are separating from each other on that side. The system s...
8477631,2022-09-08 12:07:00+01:00,Uldis_7,https://h30434.www3.hp.com/t5/Business-Notebooks/Broken-hinge/m-p/8477631?search-action-id=576248915755&search-result-uid=8477631,"['HP ENVY - 13-aq0000na', 'Microsoft Windows 11']","Hello! Unfortunately I have the same well known issue with Envy laptop hinge, in my case - right one. When I open the laptop there is the cracking sound and bottom cover on the right side next to t..."
8382612,2022-05-16 20:45:00+01:00,Gregoryy,https://h30434.www3.hp.com/t5/Notebook-Hardware-and-Upgrade-Questions/Hp-Envy-360-Broken-Hinge-Design/m-p/8382612?search-action-id=576248915755&search-result-uid=8382612,"['HP ENVY x360 13 Convertible PC (231N6AV)', 'Microsoft Windows 11']",...bsp;  ------------------------------------------------------------------------------------------------------------------------------------------------------  UPDATE:     HP has agreed to change the hinges under warranty.  Thanks
8272578,2022-01-14 22:57:00+01:00,feehwj35,https://h30434.www3.hp.com/t5/Notebook-Hardware-and-Upgrade-Questions/broken-hinge/m-p/8272578?search-action-id=576248915755&search-result-uid=8272578,"['HP Notebook - 17-by1053dx', 'Microsoft Windows 10 (64-bit)', 'hinge']",I have a broken hinge and a cracked top that covers the keyboard.  where do I go for support and email or phone number?
8185820,2021-10-09 23:17:00+01:00,E_D1,https://h30434.www3.hp.com/t5/Notebook-Hardware-and-Upgrade-Questions/HP-Envy-13-2021-Hinge-Broken/m-p/8185820?search-action-id=576248915755&search-result-uid=8185820,"['Envy 13 (2021)', 'Microsoft Windows 10 (64-bit)', 'hinge']","Hey! I bought the 2021 model of the HP Envy laptop around one year ago when I recently noticed a problem with the left hinge. When opening and closing the laptop, the case pops open a little, and w..."
7065692,2019-03-24 09:57:00+01:00,Quist,https://h30434.www3.hp.com/t5/Notebook-Hardware-and-Upgrade-Questions/Broken-hinge-on-ENVY-X360/m-p/7065692?search-action-id=576248915755&search-result-uid=7065692,"['HP ENVY x360 – 15-bp101no', 'Microsoft Windows 10 (64-bit)']","Hi.  The left hinge of my HP ENVY x360 just broke, the screen popped loose down in the corner and two screws fell out together with some plastic ""crumbles"".  I bought my computer from the HP store a..."
8213336,2021-11-12 04:01:00+01:00,Harakiri_Cat,https://h30434.www3.hp.com/t5/Notebook-Hardware-and-Upgrade-Questions/Right-Hinge-Looks-Broken-Warranty/m-p/8213336?search-action-id=576248915755&search-result-uid=8213336,"['HP Dragonfly G2', 'Microsoft Windows 10 (64-bit)', 'hinge']",Hello everyone!     Recently received a quite expensive business laptop and on 3rd day of usage right hinge does not look so good (see attached photos). Technically and aesthetically.  Question is: D...
8350989,2022-04-08 07:01:00+01:00,TheJASS,https://h30434.www3.hp.com/t5/Gaming-Notebooks/Laptop-Monitor-hinge-broken-Bezel-coming-out/m-p/8350989?search-action-id=576248915755&search-result-uid=8350989,"['HP Gaming Pavilion - 15-cx0140tx', 'Microsoft Windows 10 (64-bit)']","Hello ,  I am not able to close my laptop at all because the hinge is broken and it tears down the bezel along with it as a result i should keep my monitor stationary with some support behind to h..."
8296277,2022-02-05 22:49:00+01:00,Angus21,https://h30434.www3.hp.com/t5/Notebook-Video-Display-and-Touch/Broken-Hinge/m-p/8296277?search-action-id=576248915755&search-result-uid=8296277,['HP Pavilion - 14-ce0006tu'],Right hinge broken despite me never dropping or damaging the laptop. It is pushing the screen out and I canno longer shut the laptop in fears I won't be able to get it back open without cracking t...
